{
  "$schema": "http://json-schema.org/draft-07/schema#",
  "$id": "https://mandrel/.agents/schemas/crap-baseline.schema.json",
  "title": "CrapBaseline",
  "description": "Committed baseline envelope for the CRAP (c^2 * (1 - cov)^3 + c) gate. Rows are deterministically ordered by (file, startLine, method). Kernel and escomplex versions pin the scoring environment so consumers detect silent drift.",
  "type": "object",
  "required": ["kernelVersion", "escomplexVersion", "rows"],
  "additionalProperties": false,
  "properties": {
    "$schema": {
      "type": "string",
      "description": "Optional pointer back to this schema for editor tooling."
    },
    "kernelVersion": {
      "type": "string",
      "pattern": "^[0-9]+\\.[0-9]+\\.[0-9]+$",
      "description": "Version of the in-repo CRAP scoring kernel. Bumped when the formula or scan shape changes. From 1.1.0 onward, a mismatch against the running kernel emits a warning and the gate continues — consumers refresh on their own cadence."
    },
    "escomplexVersion": {
      "type": "string",
      "description": "Version of the package that computes the metrics (escomplex-plugin-metrics-module) used to produce this baseline. Informational: the axis that compared it was removed in Story #5336 — the v2 envelope does not carry the field, so it could not fire. scoringSemantics is the axis that rejects an incompatible scorer."
    },
    "tsTranspilerVersion": {
      "type": "string",
      "description": "Version of the `typescript` package used to strip TS/TSX sources before scoring. Optional for envelopes produced by kernel 1.0.0; required for 1.1.0+. A mismatch against the running typescript dependency emits a warning and the gate continues."
    },
    "rows": {
      "type": "array",
      "description": "Per-method CRAP scores, sorted by (file, startLine, method).",
      "items": {
        "type": "object",
        "required": ["file", "method", "startLine", "crap"],
        "additionalProperties": false,
        "properties": {
          "file": {
            "type": "string",
            "description": "Repo-relative POSIX path of the source file."
          },
          "method": {
            "type": "string",
            "description": "escomplex method name. Anonymous functions surface as '<anonymous>'."
          },
          "startLine": {
            "type": "integer",
            "minimum": 1,
            "description": "1-based escomplex lineStart used for drift-tolerant matching."
          },
          "crap": {
            "type": "number",
            "minimum": 0,
            "description": "CRAP score: c^2 * (1 - cov)^3 + c."
          }
        }
      }
    }
  }
}
