{
  "$schema": ".agents/schemas/crap-baseline.schema.json",
  "escomplexVersion": "0.1.0",
  "kernelVersion": "1.1.0",
  "rows": [
    {
      "crap": 1,
      "file": ".agents/scripts/analyze-execution.js",
      "method": "readStorySignals",
      "startLine": 70
    },
    {
      "crap": 6.141711619769646,
      "file": ".agents/scripts/analyze-execution.js",
      "method": "readPhaseTimings",
      "startLine": 89
    },
    {
      "crap": 3,
      "file": ".agents/scripts/analyze-execution.js",
      "method": "renderStoryBody",
      "startLine": 115
    },
    {
      "crap": 4,
      "file": ".agents/scripts/analyze-execution.js",
      "method": "renderQualityGateFrictionBlock",
      "startLine": 160
    },
    {
      "crap": 4,
      "file": ".agents/scripts/analyze-execution.js",
      "method": "renderBaselineRefreshRateRow",
      "startLine": 185
    },
    {
      "crap": 4,
      "file": ".agents/scripts/analyze-execution.js",
      "method": "renderEpicBody",
      "startLine": 204
    },
    {
      "crap": 6.013119533527696,
      "file": ".agents/scripts/analyze-execution.js",
      "method": "extractStoryPerfSummaryFromComment",
      "startLine": 252
    },
    {
      "crap": 1,
      "file": ".agents/scripts/analyze-execution.js",
      "method": "runStoryMode",
      "startLine": 281
    },
    {
      "crap": 8.215784143518519,
      "file": ".agents/scripts/analyze-execution.js",
      "method": "collectStorySummaries",
      "startLine": 326
    },
    {
      "crap": 4.184216709744554,
      "file": ".agents/scripts/analyze-execution.js",
      "method": "gatherEpicCommitsFromGit",
      "startLine": 386
    },
    {
      "crap": 2.000067432020095,
      "file": ".agents/scripts/analyze-execution.js",
      "method": "aggregateBaselineFrictionFromSignals",
      "startLine": 434
    },
    {
      "crap": 6.085333333333334,
      "file": ".agents/scripts/analyze-execution.js",
      "method": "runEpicMode",
      "startLine": 531
    },
    {
      "crap": 10,
      "file": ".agents/scripts/analyze-execution.js",
      "method": "parseCli",
      "startLine": 622
    },
    {
      "crap": 3.131456790123457,
      "file": ".agents/scripts/analyze-execution.js",
      "method": "main",
      "startLine": 650
    },
    {
      "crap": 1,
      "file": ".agents/scripts/delete-epic-branches.js",
      "method": "branchPatterns",
      "startLine": 36
    },
    {
      "crap": 2,
      "file": ".agents/scripts/delete-epic-branches.js",
      "method": "listLocalBranches",
      "startLine": 45
    },
    {
      "crap": 2,
      "file": ".agents/scripts/delete-epic-branches.js",
      "method": "listRemoteBranches",
      "startLine": 60
    },
    {
      "crap": 1,
      "file": ".agents/scripts/delete-epic-branches.js",
      "method": "deleteLocalBranch",
      "startLine": 78
    },
    {
      "crap": 1,
      "file": ".agents/scripts/delete-epic-branches.js",
      "method": "deleteRemoteBranch",
      "startLine": 92
    },
    {
      "crap": 1,
      "file": ".agents/scripts/delete-epic-branches.js",
      "method": "planDeletion",
      "startLine": 116
    },
    {
      "crap": 1,
      "file": ".agents/scripts/delete-epic-branches.js",
      "method": "executeDeletion",
      "startLine": 131
    },
    {
      "crap": 3,
      "file": ".agents/scripts/delete-epic-branches.js",
      "method": "parseDeleteArgs",
      "startLine": 159
    },
    {
      "crap": 3,
      "file": ".agents/scripts/delete-epic-branches.js",
      "method": "renderDryRun",
      "startLine": 178
    },
    {
      "crap": 4,
      "file": ".agents/scripts/delete-epic-branches.js",
      "method": "renderDeletionLine",
      "startLine": 192
    },
    {
      "crap": 2,
      "file": ".agents/scripts/delete-epic-branches.js",
      "method": "renderExecutionSummary",
      "startLine": 202
    },
    {
      "crap": 6,
      "file": ".agents/scripts/delete-epic-branches.js",
      "method": "emitJson",
      "startLine": 209
    },
    {
      "crap": 2,
      "file": ".agents/scripts/delete-epic-branches.js",
      "method": "emitDryRunHuman",
      "startLine": 214
    },
    {
      "crap": 6,
      "file": ".agents/scripts/delete-epic-branches.js",
      "method": "emitExecutionHuman",
      "startLine": 218
    },
    {
      "crap": 3,
      "file": ".agents/scripts/delete-epic-branches.js",
      "method": "planMainAction",
      "startLine": 237
    },
    {
      "crap": 2,
      "file": ".agents/scripts/delete-epic-branches.js",
      "method": "runDryRun",
      "startLine": 245
    },
    {
      "crap": 2,
      "file": ".agents/scripts/delete-epic-branches.js",
      "method": "runExecute",
      "startLine": 251
    },
    {
      "crap": 10.774538386783284,
      "file": ".agents/scripts/delete-epic-branches.js",
      "method": "main",
      "startLine": 258
    },
    {
      "crap": 9.005184,
      "file": ".agents/scripts/diagnose.js",
      "method": "parseArgs",
      "startLine": 57
    },
    {
      "crap": 2,
      "file": ".agents/scripts/diagnose.js",
      "method": "renderTable",
      "startLine": 96
    },
    {
      "crap": 1,
      "file": ".agents/scripts/diagnose.js",
      "method": "<anon method-4>",
      "startLine": 108
    },
    {
      "crap": 5,
      "file": ".agents/scripts/diagnose.js",
      "method": "runDiagnose",
      "startLine": 136
    },
    {
      "crap": 20,
      "file": ".agents/scripts/diagnose.js",
      "method": "main",
      "startLine": 172
    },
    {
      "crap": 3,
      "file": ".agents/scripts/epic-code-review.js",
      "method": "parseLintOutput",
      "startLine": 64
    },
    {
      "crap": 3,
      "file": ".agents/scripts/epic-code-review.js",
      "method": "partitionFilesForLint",
      "startLine": 108
    },
    {
      "crap": 4,
      "file": ".agents/scripts/epic-code-review.js",
      "method": "resolveCurrentSha",
      "startLine": 124
    },
    {
      "crap": 2,
      "file": ".agents/scripts/epic-code-review.js",
      "method": "spawnLintRunner",
      "startLine": 131
    },
    {
      "crap": 6,
      "file": ".agents/scripts/epic-code-review.js",
      "method": "runScopedLint",
      "startLine": 156
    },
    {
      "crap": 6,
      "file": ".agents/scripts/epic-code-review.js",
      "method": "parseReviewArgs",
      "startLine": 205
    },
    {
      "crap": 3.0327719617660445,
      "file": ".agents/scripts/epic-code-review.js",
      "method": "buildLintEvidenceConfig",
      "startLine": 240
    },
    {
      "crap": 6,
      "file": ".agents/scripts/epic-code-review.js",
      "method": "classifyChangedFile",
      "startLine": 262
    },
    {
      "crap": 7,
      "file": ".agents/scripts/epic-code-review.js",
      "method": "analyzeChangedFiles",
      "startLine": 302
    },
    {
      "crap": 4,
      "file": ".agents/scripts/epic-code-review.js",
      "method": "buildSeverity",
      "startLine": 338
    },
    {
      "crap": 6,
      "file": ".agents/scripts/epic-code-review.js",
      "method": "buildLintLine",
      "startLine": 356
    },
    {
      "crap": 4,
      "file": ".agents/scripts/epic-code-review.js",
      "method": "tierLabel",
      "startLine": 375
    },
    {
      "crap": 3,
      "file": ".agents/scripts/epic-code-review.js",
      "method": "buildReviewReport",
      "startLine": 383
    },
    {
      "crap": 1,
      "file": ".agents/scripts/epic-code-review.js",
      "method": "lintOffSummary",
      "startLine": 430
    },
    {
      "crap": 1,
      "file": ".agents/scripts/epic-code-review.js",
      "method": "evidenceSkippedSummary",
      "startLine": 440
    },
    {
      "crap": 6,
      "file": ".agents/scripts/epic-code-review.js",
      "method": "tryEvidenceSkip",
      "startLine": 451
    },
    {
      "crap": 7.155836556075718,
      "file": ".agents/scripts/epic-code-review.js",
      "method": "maybeRecordLintEvidence",
      "startLine": 477
    },
    {
      "crap": 3,
      "file": ".agents/scripts/epic-code-review.js",
      "method": "runLintPhase",
      "startLine": 512
    },
    {
      "crap": 7,
      "file": ".agents/scripts/epic-code-review.js",
      "method": "runEpicCodeReview",
      "startLine": 577
    },
    {
      "crap": 1,
      "file": ".agents/scripts/epic-code-review.js",
      "method": "<anon method-2>",
      "startLine": 588
    },
    {
      "crap": 2,
      "file": ".agents/scripts/epic-code-review.js",
      "method": "main",
      "startLine": 668
    },
    {
      "crap": 2,
      "file": ".agents/scripts/evidence-gate.js",
      "method": "splitOnDashDash",
      "startLine": 65
    },
    {
      "crap": 5,
      "file": ".agents/scripts/evidence-gate.js",
      "method": "parseWrapperArgs",
      "startLine": 79
    },
    {
      "crap": 4,
      "file": ".agents/scripts/evidence-gate.js",
      "method": "resolveHeadShaDefault",
      "startLine": 104
    },
    {
      "crap": 13,
      "file": ".agents/scripts/evidence-gate.js",
      "method": "runEvidenceGate",
      "startLine": 139
    },
    {
      "crap": 2,
      "file": ".agents/scripts/evidence-gate.js",
      "method": "main",
      "startLine": 229
    },
    {
      "crap": 6.0163859808830225,
      "file": ".agents/scripts/hierarchy-gate.js",
      "method": "classify",
      "startLine": 47
    },
    {
      "crap": 4,
      "file": ".agents/scripts/hierarchy-gate.js",
      "method": "ticketIsComplete",
      "startLine": 61
    },
    {
      "crap": 3,
      "file": ".agents/scripts/hierarchy-gate.js",
      "method": "collectDescendants",
      "startLine": 79
    },
    {
      "crap": 11.002039818607866,
      "file": ".agents/scripts/hierarchy-gate.js",
      "method": "runHierarchyGate",
      "startLine": 101
    },
    {
      "crap": 2,
      "file": ".agents/scripts/hierarchy-gate.js",
      "method": "main",
      "startLine": 180
    },
    {
      "crap": 15.460713385883453,